Title,Name [personal] (Creator),Name [corporate] (Creator),Place of Origin,Date,Subject - Topic,Subject - Geographic,Subject - Name [personal],Subject - Name [corporate],Abstract (Description),Note [content] (Note),Contributing Repository
"Steamer ""American,"" 1907-1908",,,,1907-1908,River steamers,Tombigbee River (Miss. and Ala.); Gainesville (Ala.),,American (Steamboat),"This is a copy photograph of copy photograph of a photolithograph of the steamer ""American"" moored at the Gainesville (Ala.) landing on the Tombigbee River.","Image caption: Landing, Tombigbee River, Gainesville, Ala This scene shows some of the great business activity along the Upper Tombigbee River for packet boats during 1907 & 1908, When the steamer "" AMEIRCAN "" was owned, and operated by, J E Stewart & Co - of Pickensville, Ala. In the trade between Demopolis Ala and Columbus Miss.",LSU Libraries. Special Collections
"Steamer ""Avalon,"" 1901",,,,Circa 1895,River steamers,,,Avalon (Steamboat),"This is a copy photograph of a photograph of the steamer ""Avalon"" underway on a waterway.","Image caption: Tennessee River packet, ""Avalon"" , later ""Ohio"".",LSU Libraries. Special Collections
"Steamer ""Columbia""",,,,circa 1900,River steamers,,,Columbia (Steamboat),"This is a copy photograph of a copy photograph of a photograph of the steamer ""Columbia"" in a waterway.","Image caption: Upper Mississippi Packet 'COLUMBIA' - Beret Neville Selma, Alabama",LSU Libraries. Special Collections
"Steamer ""Guntersville,"" 1903",,,,1903,River steamers,Guntersville (Ala.),,"Guntersville (Steamboat); Nashville, Chattanooga, and St. Louis Railway  (Company)","This is a copy photograph of a copy photograph of a photograph of a halftone print of the steamer ""Guntersville"" at a rail transfer point near Guntersville (Ala.).","Image caption: N. C. & St. L Train and Transfer Boat at Guntersville, Ala. Transfering Passengers and Loaded Freight Cars, 22 Miles to Hobbs Island, near Huntsville.",LSU Libraries. Special Collections
"Steamer ""Helen Burke,"" 1930",,,,1930,River steamers,,,Helen Burke (Steamboat),"This is a copy photograph of a copy photograph of a halftone print of the steamer ""Helen Burke"" laden with cotton bales and pushing two barges also laden with cotton bales in an unnamed waterway.","Image caption: Steamer ""Helen Burke"" Selma, Alabama 1930 5000 Bales of Cotton",LSU Libraries. Special Collections
"Landing Claiborne, Alabama",,,,circa 1900,River steamers; Cargo handling--Equipment and supplies,Claiborne (Ala.); Alabama River (Ala.),,,This is a copy photograph of a copy photograph of a halftone print of the steamboat landing near Claiborne (Ala.),"Image caption: Landing Claiborne Ala, Alabama River, showing cotton slide, dummy tracks, and 365 steps. Bert Neville",LSU Libraries. Special Collections
Landing Washington Ferry,,,,1906 ,Ferries--Alabama--Prattville,Alabama River (Ala.); Prattville (Ala.),,,This is a copy photograph of a copy photograph of a photograph of a small ferry carrying two automobiles and people.,"Image caption: Washington Ferry, Alabama River, Prattville 1906, Joe Lamar's, 1906, Haynes.",LSU Libraries. Special Collections
"Steamer ""Peerless""",,,,1918 ,River steamers,Demopolis (Ala.),,Peerless (Steamboat); Helen Burke (Steamboat); Jas. L. Hale (Towboat); Demopolis Lumber Company,"This is a copy photograph of a copy photograph of a photograph of the steamer ""Peerless"" landing at Demopolis (Ala.)","Image caption: Steamer, ""PEERLESS"". Landing at Demopolis, 1918 - shortly before boats name was changed to Helen Burke"". The little towboat, ""JAS L. HALE"", is moving two barges of sand, to let the ""PEERLESS"" land and discharge freight, and then reload other cargo for down-river points.. The Towboat was owned by Demopolis Lbr. Co.",LSU Libraries. Special Collections
"Gunboat ""Stone River,"" 1865",,,,1865 ,River steamers; Gunboats,Tennessee River,,Stone River (Steamboat),"This is a copy photograph of a copy photograph of a photograph of the steamer ""Stone River"" moored in the Tennessee River.","Image caption: Gunboat, ""Stone River"", upper Tenn River, Ala area, 1865",LSU Libraries. Special Collections
"Steamer ""Tennessee,"" 1927 April 6",,,,4/6/1927 ,River steamers,Tennessee River; Florence (Ala.),,Tennessee (Steamboat),"This is a copy photograph of a copy photograph of a photograph of the steamer ""Tennessee"" moored at Florence (Ala.)","Image caption: River packet ""TENNESSEE"", and 65 annual reunion of the Battle of Shiloh Survivers, aboard, Florence Ala, April 6th, 1927. Tennessee River. Note on verso: Steamer Tennessee Belle Capt Chas Beard, Master Ed Beard, Pilot",LSU Libraries. Special Collections
"Steamer ""Atalanta,"" 1842",,,,Circa 1845,River steamers,,,Atalanta (Steamboat),"This is a copy photograph of a copy photograph of an engraving of the steamer ""Atalanta"" moored in a waterway.","Image caption: Str, 'Atalanta' , Alabama River, 1842, probably Prarie Bluff Bert Neville Selma, Alabama",LSU Libraries. Special Collections
"Steamer ""City of Clifton""",,,,circa 1900,River steamers; Photography of interiors,,,City of Clifton (Steamboat),"This is a copy photograph of a copy photograph of a photograph of interior of the steamer ""City of Clifton""","Image caption: Cabin of Tennessee River packer ""City of Clifton"" - Bert Neville Selma, Alabama",LSU Libraries. Special Collections
"Steamer ""City of Savannah""",,,,circa 1900,River steamers; Photography of interiors,,,City of Savannah (Steamboat),"This is a copy photograph of a copy photograph of a halftone print of the interior of the steamer ""City of Savannah""","Image caption: Cabin of Tennessee River packer ""City of Savannah"" - Bert Neville Selma, Alabama",LSU Libraries. Special Collections
"Steamer ""City of Savannah""",,,,circa 1900,River steamers,,,City of Savannah (Steamboat),"This is a copy photograph of a copy photograph of a photograph of the steamer ""City of Savannah"" underway in a water way","Image caption:  ""City of Savannah"", at Clifton, Tenn.",LSU Libraries. Special Collections
"Steamer ""Clipper""",,,,circa 1900,River steamers; Lumbering--Tennessee River,,,Clipper (Steamboat),"This is a copy photograph of a copy photograph of a photograph of the steamer ""Clipper"" moored in a waterway","Image caption: Tennessee River Steamer, ""CLIPPER"", Pittsburg Lndg - This boat, owned by Doss Baker, Clifton Tenn, was a floating 'Saw Mill', going from town to town, sawing lumber -",LSU Libraries. Special Collections
"Steamer ""James T. Staples,"" 1908-1913",,,,Circa 1910,River steamers; Photography of interiors,,,James T. Staples (Steamboat),"This is a copy photograph of a copy photograph of a halftone print of the interior of the steamer ""James T. Staples""","Image caption: Cabin of Str, ""James T. Staples"", (1908-1913), Mobile, Ala. F. L Woolridge Historian seated in Cabin. Courtesy Capt. Donald T. Wright, Editor Waterways Journal. Bert Neville Selma, Alabama",LSU Libraries. Special Collections
"Saturn Barge ""Palaemon,"" 1961 March",,,,1961-03 ,Barges--Tennessee River; Towboats--Tennessee River; Rockets (Aeronautics)--Transportation,,,Palaemon (Barge); Bob Fuqua (Towboat),"This is a copy photograph of photograph of the barge ""Palaemon"" and the towboat ""Bob Fuqua"" on the Tennessee River in Decatur (Ala.)","Image caption: Saturn Barge, ""PALAEMON"", and Towboat ""BOB FUQUA"", upbound, Decatur Alabama, Mch, 1961, on first 'shakedown cruise', passing under Highway 20 Bridge at Decatur Ala - Courtesy 'NASA-Marshall Photo' Bert Neville Selma Alabama",LSU Libraries. Special Collections
"Steamer ""New Orleans,"" Sesquicentennial Postal Cover, 1962",,,New Orleans (La.),12/14/1962,River steamers; First day covers (Philately)--United States,,,New Orleans (Steamboat),"This is a first day cover commemorating the sesquicentennial of the steamer ""New Orleans"" issued in 1962","Stamp canceled New Orleans, La., 1962-12-14, 9 AM",LSU Libraries. Special Collections
"Steamer ""New Orleans,"" Sesquicentennial Postal Cover, 1962",,,New Orleans (La.),12/15/1962,River steamers; First day covers (Philately)--United States,,,New Orleans (Steamboat),"This is the information card inserted into the first day cover providing details on the steamboat New Orleans, her owners, and this first trip by steamboat from Pittsburgh (Pa.) to New Orleans (La.) in 1811-1812",,LSU Libraries. Special Collections
"Steamboat at Canal Street, New Orleans, 1895",,,,1895,River steamers,"Canal Street (New Orleans, La.)",,,This is a copy photograph of a copy photograph of a halftone print of the riverfront at the foot of Canal Street in New Orleans. There are a number of boats moored and a great deal of material awaiting transfer to the boats.,There are no discernable boat names in the image.,LSU Libraries. Special Collections
